item_code,item,unit,item_group,item_category,2024-08-14,2024-08-21,2024-08-28
1,AYAM BERSIH - STANDARD,1kg,BARANGAN SEGAR,AYAM,7.82375,7.68625,7.67
3,AYAM HIDUP,1kg,BARANGAN SEGAR,AYAM,6.8,,6.8
9,DAGING KAMBING BEBIRI IMPORT BERTULANG (MUTTON) (AUSTRALIA - KOTAK),1kg,BARANGAN SEGAR,DAGING,25.5,25.5,24.666666666666668
11,DAGING KAMBING BEBIRI IMPORT TANPA TULANG (MUTTON) (TIDAK TERMASUK PAHA - AUSTRALIA),1kg,BARANGAN SEGAR,DAGING,45.0,45.0,45.0
14,DAGING KERBAU IMPORT (INDIA) * (TOP SIDE),1kg,BARANGAN SEGAR,DAGING,20.0,19.75,20.0
93,CILI MERAH - KULAI,1kg,BARANGAN SEGAR,SAYUR-SAYURAN,16.333333333333332,16.5,16.166666666666668
94,CILI MERAH - MINYAK,1kg,BARANGAN SEGAR,SAYUR-SAYURAN,13.09,13.0,12.785714285714286
101,KELAPA BIJI,1 biji,BARANGAN SEGAR,KELAPA,1.975,2.0,2.1999999999999997
102,KELAPA PARUT,1kg,BARANGAN SEGAR,KELAPA,7.3,7.3,7.5
103,SANTAN KELAPA SEGAR (BIASA),1kg,BARANGAN SEGAR,KELAPA,6.333333333333333,6.5,6.25
104,KUBIS BULAT IMPORT (CHINA),1kg,BARANGAN SEGAR,SAYUR-SAYURAN,2.9222222222222225,3.3125,3.5
105,KUBIS BULAT (TEMPATAN),1kg,BARANGAN SEGAR,SAYUR-SAYURAN,4.75,4.25,4.25
114,TOMATO,1kg,BARANGAN SEGAR,SAYUR-SAYURAN,3.85,3.5,3.4299999999999997
118,TELUR AYAM GRED A (BERAT 65.0 GM HINGGA 69.9 GM SEBIJI),10 biji,BARANGAN SEGAR,TELUR,4.2,4.2,4.2
119,TELUR AYAM GRED B (BERAT 60.0 GM HINGGA 64.9 GM),10 biji,BARANGAN SEGAR,TELUR,4.0,4.0,4.0
120,TELUR AYAM GRED C (BERAT 55.0 GM HINGGA 59.9 GM SEBIJI),10 biji,BARANGAN SEGAR,TELUR,3.8,3.8,3.8
131,BAWANG KECIL MERAH ROSE IMPORT (INDIA),1kg,BARANGAN KERING,BAWANG,9.5,8.6,9.2
132,BAWANG KECIL MERAH IMPORT (THAILAND),1kg,BARANGAN KERING,BAWANG,12.625,13.125,13.5
368,KACANG TANAH (IMPORT),1kg,BARANGAN KERING,KACANG,7.640000000000001,7.2,7.3
1128,LADA BENGGALA HIJAU (CAPSICUM),1kg,BARANGAN SEGAR,SAYUR-SAYURAN,9.9,9.5625,9.375
1131,UBI KENTANG IMPORT (CHINA),1kg,BARANGAN KERING,UBI KENTANG,2.957142857142857,2.8857142857142857,2.8666666666666667
1367,DAGING PAHA KAMBING BEBIRI IMPORT BERTULANG  (MUTTON) (AUSTRALIA),1kg,BARANGAN SEGAR,DAGING,31.333333333333332,31.0,30.0
1369,DAGING KAMBING TEMPATAN BERTULANG,1kg,BARANGAN SEGAR,DAGING,,48.0,
1374,DAGING KERBAU TEMPATAN,1kg,BARANGAN SEGAR,DAGING,35.0,35.0,35.0
1375,DAGING KERBAU IMPORT (INDIA) * (SILVERSIDE),1kg,BARANGAN SEGAR,DAGING,19.825,19.05,19.066666666666666
1376,DAGING KERBAU IMPORT (INDIA) * (RUMP),1kg,BARANGAN SEGAR,DAGING,19.95,19.625,19.833333333333332
1377,DAGING KERBAU IMPORT (INDIA) * (BLADE),1kg,BARANGAN SEGAR,DAGING,18.9,18.46,19.075
1378,DAGING KERBAU IMPORT (INDIA) * (CHUCK),1kg,BARANGAN SEGAR,DAGING,18.7,,
1400,BAWANG PERAI (LEEK) IMPORT,1kg,BARANGAN SEGAR,SAYUR-SAYURAN,10.0,11.666666666666666,11.0
1412,KUBIS PANJANG CHINA - BESAR,1kg,BARANGAN SEGAR,SAYUR-SAYURAN,3.6,4.266666666666667,4.433333333333334
1419,KACANG DAL BIASA (INDIA),1kg,BARANGAN KERING,KACANG,11.0,11.0,
1420,KACANG DAL MALAVI (INDIA),1kg,BARANGAN KERING,KACANG,9.666666666666666,9.666666666666666,9.5
1422,KACANG DAL (AUSTRALIA),1kg,BARANGAN KERING,KACANG,4.36,4.15,4.2
1431,DAGING LEMBU TEMPATAN (BAHAGIAN 1 DAGING PAHA (KECUALI BATANG PINANG - TENDERLOIN),1kg,BARANGAN SEGAR,DAGING,37.0,37.0,36.5
1432,DAGING LEMBU TEMPATAN (BAHAGIAN 2 DAGING PEJAL (KECUALI BATANG PINANG - TENDERLOIN),1kg,BARANGAN SEGAR,DAGING,37.666666666666664,37.666666666666664,37.5
1440,BAWANG BESAR IMPORT (INDIA),1kg,BARANGAN KERING,BAWANG,4.75,3.66,4.0600000000000005
1441,BAWANG BESAR IMPORT (CHINA),1kg,BARANGAN KERING,BAWANG,4.5,3.875,3.5
1442,BAWANG KECIL MERAH BIASA IMPORT (INDIA),1kg,BARANGAN KERING,BAWANG,4.675,4.566666666666666,3.733333333333333
1458,KUBIS BULAT IMPORT (BEIJING),1kg,BARANGAN SEGAR,SAYUR-SAYURAN,4.7,4.86,5.0
1475,IKAN BAWAL PUTIH (ANTARA 2 HINGGA 5 EKOR SEKILOGRAM),1kg,BARANGAN SEGAR,BAHAN LAUT,40.5,38.0,38.0
1476,IKAN KEMBUNG (ANTARA 8 HINGGA 12 EKOR SEKILOGRAM),1kg,BARANGAN SEGAR,BAHAN LAUT,14.25,12.875,14.166666666666666
1477,IKAN MABUNG (ANTARA 6 HINGGA 10 EKOR SEKILOGRAM),1kg,BARANGAN SEGAR,BAHAN LAUT,15.5,15.166666666666666,15.0
1479,BROKOLI,1kg,BARANGAN SEGAR,SAYUR-SAYURAN,12.11111111111111,13.3125,13.3125
1481,KUBIS BUNGA (CAULIFLOWER),1kg,BARANGAN SEGAR,SAYUR-SAYURAN,7.858333333333333,8.35,8.51
1482,KUBIS PANJANG (TEMPATAN),1kg,BARANGAN SEGAR,SAYUR-SAYURAN,4.86,4.375,4.625
1491,BERAS PULUT THAILAND (SUSU) PELBAGAI JENAMA,1kg,BARANGAN BERBUNGKUS,BERAS,7.5,7.5,7.5
1492,BERAS PULUT THAILAND (BIASA) PELBAGAI JENAMA,1kg,BARANGAN BERBUNGKUS,BERAS,6.0,6.0,6.0
1555,UDANG PUTIH/VANNAMEI (TERNAK) (ANTARA 41 HINGGA 60 EKOR SEKILOGRAM),1kg,BARANGAN SEGAR,BAHAN LAUT,28.6875,28.916666666666668,29.0
1564,BAWANG PUTIH IMPORT (CHINA),1kg,BARANGAN KERING,BAWANG,10.775,11.6,11.233333333333334
1804,KEPAK AYAM (CHICKEN WING) (1KG),1kg,BARANGAN SEGAR,AYAM,16.0,16.0,18.0
1929,SANTAN KELAPA SEGAR (PEKAT),1kg,BARANGAN SEGAR,KELAPA,10.666666666666666,10.666666666666666,11.5
