item_code,item,unit,item_group,item_category,2022-02-09,2022-02-16,2022-02-23
1,AYAM BERSIH - STANDARD,1kg,BARANGAN SEGAR,AYAM,7.25,7.25,7.25
3,AYAM HIDUP,1kg,BARANGAN SEGAR,AYAM,6.05,6.05,6.05
9,DAGING KAMBING BEBIRI IMPORT BERTULANG (MUTTON) (AUSTRALIA - KOTAK),1kg,BARANGAN SEGAR,DAGING,32.0,32.0,32.0
10,DAGING KAMBING BEBIRI IMPORT BERTULANG (MUTTON) (NEW ZEALAND - KOTAK),1kg,BARANGAN SEGAR,DAGING,32.0,32.0,32.0
14,DAGING KERBAU IMPORT (INDIA) * (TOP SIDE),1kg,BARANGAN SEGAR,DAGING,17.0,17.0,17.0
93,CILI MERAH - KULAI,1kg,BARANGAN SEGAR,SAYUR-SAYURAN,14.333333333333334,14.333333333333334,15.0
94,CILI MERAH - MINYAK,1kg,BARANGAN SEGAR,SAYUR-SAYURAN,13.0,,
101,KELAPA BIJI,1 biji,BARANGAN SEGAR,KELAPA,2.0,2.0,2.05
102,KELAPA PARUT,1kg,BARANGAN SEGAR,KELAPA,6.7,6.7,6.7
103,SANTAN KELAPA SEGAR (BIASA),1kg,BARANGAN SEGAR,KELAPA,7.0,7.0,7.0
104,KUBIS BULAT IMPORT (CHINA),1kg,BARANGAN SEGAR,SAYUR-SAYURAN,3.5,3.5,
105,KUBIS BULAT (TEMPATAN),1kg,BARANGAN SEGAR,SAYUR-SAYURAN,5.333333333333333,5.5,4.333333333333333
114,TOMATO,1kg,BARANGAN SEGAR,SAYUR-SAYURAN,4.75,5.5,5.5
118,TELUR AYAM GRED A (BERAT 65.0 GM HINGGA 69.9 GM SEBIJI),10 biji,BARANGAN SEGAR,TELUR,4.1,4.1,4.1
119,TELUR AYAM GRED B (BERAT 60.0 GM HINGGA 64.9 GM),10 biji,BARANGAN SEGAR,TELUR,3.9,3.9,3.9
120,TELUR AYAM GRED C (BERAT 55.0 GM HINGGA 59.9 GM SEBIJI),10 biji,BARANGAN SEGAR,TELUR,3.7,3.7,3.7
131,BAWANG KECIL MERAH ROSE IMPORT (INDIA),1kg,BARANGAN KERING,BAWANG,17.0,16.5,16.0
132,BAWANG KECIL MERAH IMPORT (THAILAND),1kg,BARANGAN KERING,BAWANG,12.5,12.0,13.0
368,KACANG TANAH (IMPORT),1kg,BARANGAN KERING,KACANG,7.6000000000000005,7.933333333333334,7.8
1128,LADA BENGGALA HIJAU (CAPSICUM),1kg,BARANGAN SEGAR,SAYUR-SAYURAN,14.0,12.0,13.0
1131,UBI KENTANG IMPORT (CHINA),1kg,BARANGAN KERING,UBI KENTANG,2.25,,2.0
1367,DAGING PAHA KAMBING BEBIRI IMPORT BERTULANG  (MUTTON) (AUSTRALIA),1kg,BARANGAN SEGAR,DAGING,38.0,38.0,38.0
1368,DAGING PAHA KAMBING BEBIRI IMPORT BERTULANG (MUTTON) (NEW ZEALAND),1kg,BARANGAN SEGAR,DAGING,38.0,38.0,38.0
1375,DAGING KERBAU IMPORT (INDIA) * (SILVERSIDE),1kg,BARANGAN SEGAR,DAGING,16.5,16.5,16.5
1376,DAGING KERBAU IMPORT (INDIA) * (RUMP),1kg,BARANGAN SEGAR,DAGING,16.5,16.5,16.5
1377,DAGING KERBAU IMPORT (INDIA) * (BLADE),1kg,BARANGAN SEGAR,DAGING,16.0,16.0,16.0
1379,DAGING BABI (PERUT / BELLY),1kg,BARANGAN SEGAR,DAGING,21.0,21.0,21.0
1380,DAGING BABI (DAGING & LEMAK / LEAN & FAT),1kg,BARANGAN SEGAR,DAGING,14.0,14.0,14.0
1381,DAGING BABI (ISI DAGING / PURE LEAN),1kg,BARANGAN SEGAR,DAGING,16.0,16.0,16.0
1383,DAGING BABI (RUSUK DENGAN DAGING/ RIBS WITH MEAT),1kg,BARANGAN SEGAR,DAGING,15.0,15.0,15.0
1399,BAWANG PERAI (LEEK) TEMPATAN,1kg,BARANGAN SEGAR,SAYUR-SAYURAN,,,12.0
1419,KACANG DAL BIASA (INDIA),1kg,BARANGAN KERING,KACANG,,6.8,6.8
1420,KACANG DAL MALAVI (INDIA),1kg,BARANGAN KERING,KACANG,7.8,7.8,7.8
1422,KACANG DAL (AUSTRALIA),1kg,BARANGAN KERING,KACANG,3.0,3.1666666666666665,3.25
1431,DAGING LEMBU TEMPATAN (BAHAGIAN 1 DAGING PAHA (KECUALI BATANG PINANG - TENDERLOIN),1kg,BARANGAN SEGAR,DAGING,36.0,36.0,36.0
1432,DAGING LEMBU TEMPATAN (BAHAGIAN 2 DAGING PEJAL (KECUALI BATANG PINANG - TENDERLOIN),1kg,BARANGAN SEGAR,DAGING,36.0,36.0,36.0
1440,BAWANG BESAR IMPORT (INDIA),1kg,BARANGAN KERING,BAWANG,3.1,3.1,2.8
1442,BAWANG KECIL MERAH BIASA IMPORT (INDIA),1kg,BARANGAN KERING,BAWANG,5.9,5.9,5.9
1458,KUBIS BULAT IMPORT (BEIJING),1kg,BARANGAN SEGAR,SAYUR-SAYURAN,5.75,5.75,5.5
1476,IKAN KEMBUNG (ANTARA 8 HINGGA 12 EKOR SEKILOGRAM),1kg,BARANGAN SEGAR,BAHAN LAUT,,,18.0
1477,IKAN MABUNG (ANTARA 6 HINGGA 10 EKOR SEKILOGRAM),1kg,BARANGAN SEGAR,BAHAN LAUT,14.5,13.0,16.0
1479,BROKOLI,1kg,BARANGAN SEGAR,SAYUR-SAYURAN,11.0,11.5,10.5
1481,KUBIS BUNGA (CAULIFLOWER),1kg,BARANGAN SEGAR,SAYUR-SAYURAN,6.5,6.75,7.0
1482,KUBIS PANJANG (TEMPATAN),1kg,BARANGAN SEGAR,SAYUR-SAYURAN,5.5,5.5,5.5
1555,UDANG PUTIH/VANNAMEI (TERNAK) (ANTARA 41 HINGGA 60 EKOR SEKILOGRAM),1kg,BARANGAN SEGAR,BAHAN LAUT,25.5,24.5,
1564,BAWANG PUTIH IMPORT (CHINA),1kg,BARANGAN KERING,BAWANG,8.0,8.0,8.0
1804,KEPAK AYAM (CHICKEN WING) (1KG),1kg,BARANGAN SEGAR,AYAM,13.0,13.0,
1929,SANTAN KELAPA SEGAR (PEKAT),1kg,BARANGAN SEGAR,KELAPA,8.0,8.0,8.0
